{
  "$schema": "https://json-schema.org/draft/2020-12/schema",
  "$id": "https://github.com/clockcrockwork/Interactive-alice/schema/locale-chapter.schema.json",
  "title": "Locale chapter file",
  "description": "Visible text for one chapter in one language. Segment ids and their order are owned by the matching text/story/chNN.structure.json file.",
  "type": "object",
  "required": ["locale", "chapter", "title", "scenes", "segments"],
  "additionalProperties": false,
  "properties": {
    "locale": { "type": "string", "description": "BCP 47 tag, or a tag plus variant such as en-simple. Must be a key of text/locales.json." },
    "chapter": { "type": "integer", "minimum": 1, "maximum": 12 },
    "title": { "type": "string", "minLength": 1, "description": "Chapter title in this language." },
    "scenes": {
      "type": "object",
      "description": "Scene id to scene title in this language.",
      "additionalProperties": { "type": "string", "minLength": 1 }
    },
    "segments": {
      "type": "object",
      "description": "Segment id to one short sentence in this language.",
      "propertyNames": { "pattern": "^ch[0-9]{2}\\.s[0-9]{4}$" },
      "additionalProperties": { "type": "string", "minLength": 1 }
    }
  }
}
