{
  "locale": "ja",
  "chapter": 1,
  "title": "うさぎの あなを おちて",
  "scenes": {
    "riverbank": "川の ほとりで",
    "white-rabbit": "白い うさぎ",
    "the-hole": "あなの 中へ",
    "the-fall": "おちて おちて おちて",
    "landing": "長い ろうか",
    "the-hall": "ドアだらけの へや",
    "drink-me": "わたしを のんで",
    "eat-me": "わたしを たべて"
  },
  "segments": {
    "ch01.s0010": "アリスは 川の ほとりに すわっていました。",
    "ch01.s0020": "となりでは おねえさんが 本を よんでいます。",
    "ch01.s0030": "その本には 絵が ありません。",
    "ch01.s0040": "だれも おしゃべりを しません。",
    "ch01.s0050": "そんな本、なんの やくに たつのかしら。",
    "ch01.s0060": "あつい日で、アリスは ねむくなりました。",
    "ch01.s0070": "花の くびかざりを つくろうかな。",
    "ch01.s0080": "でも 花を つむのは めんどうです。",
    "ch01.s0090": "そのとき 白い うさぎが かけぬけました。",
    "ch01.s0100": "目は ピンクいろ でした。",
    "ch01.s0110": "たいへん、たいへん。おくれちゃう！",
    "ch01.s0120": "アリスは あまり ふしぎに おもいません。",
    "ch01.s0130": "すると うさぎは ポケットから とけいを 出しました。",
    "ch01.s0140": "とけいを 見て、また いそぎ足に なります。",
    "ch01.s0150": "アリスは ぱっと 立ちあがりました。",
    "ch01.s0160": "ポケットの ある うさぎなんて はじめてです。",
    "ch01.s0170": "とけいを もつ うさぎも はじめてです。",
    "ch01.s0180": "アリスは のはらを かけて おいかけました。",
    "ch01.s0190": "うさぎは いけがきの下の あなに とびこみました。",
    "ch01.s0200": "アリスも そのまま とびこみました。",
    "ch01.s0210": "どうやって 出るのか、考えも しません。",
    "ch01.s0220": "あなは トンネルのように まっすぐ つづきます。",
    "ch01.s0230": "そして 足もとが すっと なくなりました。",
    "ch01.s0240": "アリスは ふかい いどを おちて いきます。",
    "ch01.s0250": "とても ふかい いどなのかな。",
    "ch01.s0260": "それとも ゆっくり おちているのかな。",
    "ch01.s0270": "どちらでも、まわりを 見る ひまは たっぷり。",
    "ch01.s0280": "下を 見ても、暗くて 何も 見えません。",
    "ch01.s0290": "かべは たなや 食器だなで いっぱいです。",
    "ch01.s0300": "地図や 絵も かけて あります。",
    "ch01.s0310": "アリスは とおりすぎに びんを とりました。",
    "ch01.s0320": "ラベルには オレンジジャムと あります。",
    "ch01.s0330": "でも 中は からっぽ でした。",
    "ch01.s0340": "下に だれか いたら たいへんです。",
    "ch01.s0350": "だから おちながら たなに しまいました。",
    "ch01.s0360": "これだけ おちたら、かいだんなんて へいきよ。",
    "ch01.s0370": "みんな わたしを ゆうかんだと 思うわ。",
    "ch01.s0380": "おちて、おちて、おちて いきます。",
    "ch01.s0390": "この おちるのは おわらないの？",
    "ch01.s0400": "わたし、どれくらい おちたのかしら。",
    "ch01.s0410": "もう 地球の 中心の ちかく かもしれない。",
    "ch01.s0420": "それなら 六千キロも 下に なるわね。",
    "ch01.s0430": "聞いてくれる人は だれも いません。",
    "ch01.s0440": "それでも 声に 出すのは いい れんしゅう。",
    "ch01.s0450": "地球を つきぬけたら どうなるの？",
    "ch01.s0460": "さかさまに 歩く人の ところに 出るのかしら。",
    "ch01.s0470": "国の 名前を 聞かないと いけないわ。",
    "ch01.s0480": "アリスは おちながら おじぎを しました。",
    "ch01.s0490": "空の 中で おじぎ、できると 思う？",
    "ch01.s0500": "まだまだ おちて いきます。",
    "ch01.s0510": "こんばん ダイナは さびしがるわね。",
    "ch01.s0520": "ダイナは アリスの ねこです。",
    "ch01.s0530": "ミルクを わすれないで いてほしいな。",
    "ch01.s0540": "ダイナ、いっしょに いてくれたら いいのに。",
    "ch01.s0550": "空の 中には ねずみは いないけど。",
    "ch01.s0560": "こうもりなら つかまえられるかも。",
    "ch01.s0570": "こうもりは ねずみに よく にているわ。",
    "ch01.s0580": "ねこは こうもりを たべるの？",
    "ch01.s0590": "こうもりは ねこを たべるの？",
    "ch01.s0600": "どちらも こたえは わかりません。",
    "ch01.s0610": "アリスは だんだん ねむく なりました。",
    "ch01.s0620": "ダイナと 手を つないで 歩く ゆめを 見かけます。",
    "ch01.s0630": "どさっ。どさっ。",
    "ch01.s0640": "アリスは 枝と かれ葉の 山に おちました。",
    "ch01.s0650": "長い らっかは おわりです。",
    "ch01.s0660": "けがは なく、すぐに 立ちあがりました。",
    "ch01.s0670": "上を 見ると、まっ暗です。",
    "ch01.s0680": "前には 長い ろうかが つづいています。",
    "ch01.s0690": "白い うさぎが まだ いそいで います。",
    "ch01.s0700": "アリスは かぜのように かけだしました。",
    "ch01.s0710": "おお、わたしの 耳と ひげ。もう こんな 時間だ。",
    "ch01.s0720": "そう 言って うさぎは かどを まがりました。",
    "ch01.s0730": "アリスが まがると、もう いません。",
    "ch01.s0740": "そこは 天じょうの ひくい 長い へや。",
    "ch01.s0750": "天じょうには ランプが ならんで います。",
    "ch01.s0760": "ぐるりと ドアが ならんで います。",
    "ch01.s0770": "アリスは ぜんぶ あけて みました。",
    "ch01.s0780": "どのドアにも かぎが かかって います。",
    "ch01.s0790": "しょんぼり へやの まん中を 歩きます。",
    "ch01.s0800": "すると 小さな ガラスの つくえが ありました。",
    "ch01.s0810": "上には 金いろの 小さな かぎが 一つ。",
    "ch01.s0820": "どの かぎあなにも 小さすぎます。",
    "ch01.s0830": "二しゅう目に、ひくい カーテンを 見つけました。",
    "ch01.s0840": "うしろには 小さな ドアが あります。",
    "ch01.s0850": "せいは アリスの うでくらい。",
    "ch01.s0860": "金の かぎは ぴったり あいました。",
    "ch01.s0870": "アリスは ドアを あけて、ひざを つきました。",
    "ch01.s0880": "中は ねずみの あなほどの ほそい みちです。",
    "ch01.s0890": "おくには とても きれいな 庭が 見えます。",
    "ch01.s0900": "あかるい 花と すずしい ふん水が あります。",
    "ch01.s0910": "でも 頭さえ 通りません。",
    "ch01.s0920": "ぼうえんきょうみたいに ちぢめたら いいのに。",
    "ch01.s0930": "きょうは ふしぎな ことばかり おきました。",
    "ch01.s0940": "できない ことなんて 少ないのかも。",
    "ch01.s0950": "アリスは ガラスの つくえに もどりました。",
    "ch01.s0960": "すると 小さな びんが のっています。",
    "ch01.s0970": "さっきまで こんなの なかったわ。",
    "ch01.s0980": "くびに 紙の ラベルが さがって います。",
    "ch01.s0990": "大きな字で「わたしを のんで」と あります。",
    "ch01.s1000": "かしこい アリスは すぐには のみません。",
    "ch01.s1010": "まず どくと 書いて ないか しらべるわ。",
    "ch01.s1020": "どこにも その字は ありません。",
    "ch01.s1030": "そこで ひとくち なめて みました。",
    "ch01.s1040": "さくらんぼパイや カスタードの あじが します。",
    "ch01.s1050": "アリスは ぜんぶ のんで しまいました。",
    "ch01.s1060": "なんて ふしぎな きもち。",
    "ch01.s1070": "ぼうえんきょうみたいに ちぢんで いくわ。",
    "ch01.s1080": "ほんとうに そうでした。",
    "ch01.s1090": "アリスは もう 手のひら 二つ分の せい。",
    "ch01.s1100": "やっと 小さな ドアに ちょうどの 大きさです。",
    "ch01.s1110": "もっと ちぢまないか、すこし まちました。",
    "ch01.s1120": "ろうそくみたいに きえたら こまるもの。",
    "ch01.s1130": "もう 何も おきないので 庭へ 行きます。",
    "ch01.s1140": "でも、かわいそうな アリス。",
    "ch01.s1150": "金の かぎを つくえに わすれました。",
    "ch01.s1160": "ガラスごしに ちゃんと 見えます。",
    "ch01.s1170": "足を のぼろうと しても つるつる です。",
    "ch01.s1180": "アリスは すわって 泣きました。",
    "ch01.s1190": "そんなに 泣いても しかたないわ。",
    "ch01.s1200": "いますぐ やめなさい。",
    "ch01.s1210": "アリスは 自分に よい ことを 言います。",
    "ch01.s1220": "でも ほとんど 聞きません。",
    "ch01.s1230": "つくえの下に ガラスの 箱が ありました。",
    "ch01.s1240": "中には とても 小さな ケーキ。",
    "ch01.s1250": "ほしぶどうで「たべて」と 書いて あります。",
    "ch01.s1260": "よし、たべて みましょう。",
    "ch01.s1270": "大きく なれば かぎに 手が とどく。",
    "ch01.s1280": "小さく なれば ドアの 下を くぐれる。",
    "ch01.s1290": "どちらでも 庭に 行けるわ。",
    "ch01.s1300": "アリスは ひとくち たべました。",
    "ch01.s1310": "どっち？ どっちに なるの？",
    "ch01.s1320": "頭に 手を のせて たしかめます。",
    "ch01.s1330": "何も おきません。",
    "ch01.s1340": "せいは まったく 同じ ままです。",
    "ch01.s1350": "ケーキを たべたら ふつうは そうです。",
    "ch01.s1360": "でも アリスは ふしぎを まっていました。",
    "ch01.s1370": "そこで ケーキを ぜんぶ たべました。"
  }
}
